{
  "version": "2.0",
  "date": "2026-08-04",
  "options": {
    "animate": false,
    "showLabels": true,
    "height": "standard"
  },
  "recipe": "comparison.change",
  "title": "The Black Sea Urals Discount Widened as Tanker Costs Rose",
  "subtitle": "The discount increased by $1.10 per barrel after attacks reduced tanker availability around Novorossiysk.",
  "source": {
    "name": "Platts and Russian oil-market reporting",
    "period": "July 2026"
  },
  "data": [
    {
      "label": "Previous discount",
      "value": 25.5,
      "displayValue": "$25.50/bbl",
      "valueStatus": "derived",
      "quantity": "Urals crude discount",
      "scope": "Black Sea Urals crude benchmark",
      "period": "Before latest July 2026 move",
      "tone": "neutral"
    },
    {
      "label": "Latest discount",
      "value": 26.6,
      "displayValue": "$26.60/bbl",
      "valueStatus": "reported",
      "quantity": "Urals crude discount",
      "scope": "Black Sea Urals crude benchmark",
      "period": "Late July 2026",
      "tone": "critical"
    }
  ],
  "measure": {
    "quantity": "Urals crude discount",
    "unit": "USD/barrel",
    "decimals": 1,
    "baseline": "zero"
  },
  "emphasis": {
    "direction": "up",
    "displayValue": "+$1.10",
    "label": "wider discount",
    "position": "between"
  },
  "supportingFacts": [
    {
      "value": "+14.6%",
      "label": "July increase in Novorossiysk-to-India transportation prices.",
      "tone": "critical"
    },
    {
      "value": "Fewer tankers",
      "label": "Reduced vessel availability transmitted security risk into the crude discount.",
      "tone": "warning"
    }
  ],
  "note": "Previous discount derived as $26.60 minus the reported $1.10 widening.",
  "narrative": {
    "frame": "warning",
    "density": "editorial",
    "emphasis": "direction"
  },
  "metadata": {
    "slug": "urals-discount-freight",
    "country": "Russia",
    "topic": "Urals discount and freight",
    "dataPeriod": "July 2026",
    "keyFinding": "Tanker disruption widened the Black Sea Urals discount and raised India-bound freight costs."
  }
}
