{
  "version": "2.0",
  "date": "2026-08-04",
  "options": {
    "animate": false,
    "showLabels": true,
    "height": "short",
    "showLegend": true,
    "labelMode": "inside"
  },
  "recipe": "composition.stacked",
  "title": "Wildberries Asked for 800 Billion Rubles in State Support",
  "subtitle": "The request split 500 billion rubles for seller support and 300 billion for warehouse air defense; Reuters later reported no specific aid decision by July 28.",
  "source": {
    "name": "Russian e-commerce reporting; Reuters status update",
    "period": "July 2026"
  },
  "data": [
    {
      "label": "Seller support fund",
      "value": 500,
      "displayValue": "500bn RUB",
      "tone": "warning"
    },
    {
      "label": "Warehouse air defense",
      "value": 300,
      "displayValue": "300bn RUB",
      "tone": "critical"
    }
  ],
  "supportingFacts": [
    {
      "value": "No decision by 28 July",
      "label": "Reuters reported that government discussions were continuing without a specific aid decision.",
      "tone": "neutral"
    },
    {
      "value": "88,000 small sellers",
      "label": "Wildberries said its first internal support measures prioritized the smallest sellers affected at Elektrostal.",
      "tone": "primary"
    }
  ],
  "note": "The requested amounts are distinct from approved or disbursed state support.",
  "measure": {
    "unit": "billion rubles",
    "decimals": 0,
    "baseline": "zero"
  },
  "narrative": {
    "frame": "warning",
    "density": "editorial",
    "emphasis": "composition"
  },
  "metadata": {
    "slug": "wildberries-support-request",
    "country": "Russia",
    "topic": "Wildberries state support",
    "dataPeriod": "July 2026",
    "keyFinding": "Wildberries asked for 800 billion rubles in state support, while the government had not announced a specific aid decision by July 28."
  }
}
