{
  "version": "2.0",
  "date": "2026-08-04",
  "options": {
    "animate": false,
    "showLabels": true,
    "height": "standard"
  },
  "recipe": "comparison.change",
  "title": "Russia’s Online-Trading Company Base Contracted for the First Time Since 2021",
  "subtitle": "The active company count fell by an estimated 23,500 in the first half of 2026.",
  "source": {
    "name": "Russian marketplace company-registration reporting",
    "period": "H1 2026"
  },
  "data": [
    {
      "label": "Implied prior level",
      "value": 480231,
      "displayValue": "about 480,200",
      "valueStatus": "derived",
      "quantity": "active online-trading companies",
      "scope": "Russian companies operating through online commerce channels",
      "period": "Before H1 2026 decline",
      "tone": "neutral"
    },
    {
      "label": "H1 2026 level",
      "value": 456700,
      "displayValue": "456,700",
      "valueStatus": "reported",
      "quantity": "active online-trading companies",
      "scope": "Russian companies operating through online commerce channels",
      "period": "End of H1 2026",
      "tone": "critical"
    }
  ],
  "measure": {
    "quantity": "active online-trading companies",
    "unit": "companies",
    "decimals": 0,
    "baseline": "zero"
  },
  "emphasis": {
    "direction": "down",
    "displayValue": "−4.9%",
    "label": "company base",
    "position": "between"
  },
  "supportingFacts": [
    {
      "value": "−23,500",
      "label": "Approximate reduction implied by the reported percentage and ending count.",
      "tone": "critical"
    },
    {
      "value": "First since 2021",
      "label": "The sector had expanded in each intervening period.",
      "tone": "warning"
    }
  ],
  "note": "Prior value derived as 456,700 ÷ 0.951; rounded to the nearest hundred in display copy.",
  "narrative": {
    "frame": "collapse",
    "density": "editorial",
    "emphasis": "direction"
  },
  "metadata": {
    "slug": "ecommerce-active-company-base",
    "country": "Russia",
    "topic": "e-commerce company count",
    "dataPeriod": "H1 2026",
    "keyFinding": "The active online-trading company base declined 4.9% to 456,700."
  }
}
