{
  "version": "2.0",
  "recipe": "composition.stacked",
  "title": "Four Buyers in Five Go Home Empty",
  "subtitle": "Gasoline volumes sold on the exchange covered only 18.1% of solvent demand, leaving most buyers unable to obtain fuel even when they had funds available.",
  "date": "2026-07-26",
  "source": {
    "name": "Saint Petersburg International Mercantile Exchange demand coverage",
    "period": "July 2026"
  },
  "data": [
    {
      "label": "Demand served",
      "value": 18.1,
      "displayValue": "18.1%",
      "tone": "primary",
      "annotation": "A little over 10,000 tons per day changed hands."
    },
    {
      "label": "Demand unmet",
      "value": 81.9,
      "displayValue": "81.9%",
      "tone": "critical",
      "annotation": "Roughly 45,000 tons of solvent daily demand remained unfilled."
    }
  ],
  "measure": {
    "unit": "%",
    "decimals": 1,
    "baseline": "zero",
    "scale": "linear",
    "valueMode": "share",
    "levelAvailability": "not-applicable"
  },
  "narrative": {
    "frame": "collapse",
    "density": "editorial",
    "emphasis": "composition"
  },
  "options": {
    "height": "short",
    "sort": "none",
    "showLegend": false,
    "showLabels": true,
    "animate": true,
    "labelMode": "inside"
  },
  "metadata": {
    "slug": "spimex-demand-stacked",
    "topic": "gasoline exchange demand coverage",
    "country": "Russia",
    "dataPeriod": "July 2026",
    "keyFinding": "Only 18.1% of solvent gasoline demand was served."
  }
}
