{
  "version": "2.0",
  "recipe": "composition.stacked",
  "title": "Wildberries Has Asked the State for Eight Hundred Billion Rubles",
  "subtitle": "The marketplace requested 500 billion rubles to compensate sellers and a further 300 billion rubles to buy air defence for its own warehouses.",
  "date": "2026-08-02",
  "source": {
    "name": "Wildberries requests to the Russian government reported by Russian business media",
    "period": "July 2026"
  },
  "data": [
    {
      "label": "Compensation for sellers",
      "value": 500,
      "displayValue": "500 billion rubles",
      "tone": "critical",
      "annotation": "Money for merchants whose goods were destroyed or locked in damaged warehouses."
    },
    {
      "label": "Air defence for warehouses",
      "value": 300,
      "displayValue": "300 billion rubles",
      "tone": "warning",
      "annotation": "A private company asking the budget to militarise its own logistics estate."
    }
  ],
  "measure": {
    "unit": "billion rubles",
    "decimals": 0,
    "baseline": "zero",
    "scale": "linear"
  },
  "primaryMetric": {
    "value": "800 billion rubles",
    "label": "total requested from the federal budget"
  },
  "supportingFacts": [
    {
      "value": "M&A frozen",
      "label": "The company cancelled acquisitions and paused investment programmes while the requests were outstanding.",
      "tone": "warning"
    },
    {
      "value": "Perverse incentive",
      "label": "Compensation diverts budget money away from the army, strengthening the case for further strikes.",
      "tone": "critical"
    }
  ],
  "narrative": {
    "frame": "collapse",
    "density": "editorial",
    "emphasis": "composition"
  },
  "options": {
    "height": "short",
    "sort": "none",
    "showLegend": true,
    "showLabels": true,
    "animate": true,
    "labelMode": "inside"
  },
  "metadata": {
    "slug": "02-wildberries-state-support-request-2026",
    "topic": "corporate bailout requests",
    "country": "Russia",
    "dataPeriod": "July 2026",
    "keyFinding": "Wildberries asked for 800 billion rubles, including 300 billion for air defence."
  }
}
