{
  "version": "2.0",
  "recipe": "map.regional",
  "title": "Synthetic Routing Matrix: Dense 03",
  "subtitle": "Adversarial coverage packs adjacent and remote regions into crowded port lanes.",
  "date": "2026-08-03",
  "source": {
    "name": "Seeded synthetic routing matrix",
    "period": "Seed 20260803 / adversarial"
  },
  "data": [
    {
      "label": "Primorsky",
      "regionId": "RU-PRI",
      "status": "improving",
      "displayValue": "4 units",
      "detail": "Dense sample 3, anchor 1."
    },
    {
      "label": "Khabarovsk",
      "regionId": "RU-KHA",
      "status": "unknown",
      "displayValue": "17 units",
      "detail": "Dense sample 3, anchor 2."
    },
    {
      "label": "Magadan",
      "regionId": "RU-MAG",
      "status": "unknown",
      "displayValue": "19 units",
      "detail": "Dense sample 3, anchor 3."
    },
    {
      "label": "Chukotka",
      "regionId": "RU-CHU",
      "status": "strained",
      "displayValue": "28 units",
      "detail": "Dense sample 3, anchor 4."
    },
    {
      "label": "Yamalo-Nenets",
      "regionId": "RU-YAN",
      "status": "unknown",
      "displayValue": "32 units",
      "detail": "Dense sample 3, anchor 5."
    },
    {
      "label": "Sakha",
      "regionId": "RU-SA",
      "status": "stable",
      "displayValue": "31 units",
      "detail": "Dense sample 3, anchor 6."
    },
    {
      "label": "Zabaykalsky",
      "regionId": "RU-ZAB",
      "status": "critical",
      "displayValue": "19 units",
      "detail": "Dense sample 3, anchor 7."
    },
    {
      "label": "Murmansk",
      "regionId": "RU-MUR",
      "status": "strained",
      "displayValue": "13 units",
      "detail": "Dense sample 3, anchor 8."
    },
    {
      "label": "Krasnodar",
      "regionId": "RU-KDA",
      "status": "strained",
      "displayValue": "37 units",
      "detail": "Dense sample 3, anchor 9."
    },
    {
      "label": "Amur",
      "regionId": "RU-AMU",
      "status": "stable",
      "displayValue": "11 units",
      "detail": "Dense sample 3, anchor 10."
    },
    {
      "label": "Nenets",
      "regionId": "RU-NEN",
      "status": "stable",
      "displayValue": "29 units",
      "detail": "Dense sample 3, anchor 11."
    },
    {
      "label": "Kamchatka",
      "regionId": "RU-KAM",
      "status": "unknown",
      "displayValue": "10 units",
      "detail": "Dense sample 3, anchor 12."
    }
  ],
  "map": {
    "regionSet": "russia",
    "viewport": "all",
    "summaryDisplay": "hide",
    "summaryPosition": "none",
    "leaderRouting": "ports"
  },
  "primaryMetric": {
    "value": "12 regions",
    "label": "dense routing sample"
  },
  "supportingFacts": [
    {
      "value": "1",
      "label": "critical or blocked dummy regions",
      "tone": "critical"
    },
    {
      "value": "1",
      "label": "dummy regions improving",
      "tone": "positive"
    }
  ],
  "narrative": {
    "frame": "neutral",
    "density": "detailed",
    "emphasis": "geography"
  },
  "options": {
    "height": "tall",
    "animate": false
  },
  "metadata": {
    "slug": "regional-routing-dense-03",
    "topic": "synthetic regional routing matrix",
    "country": "Russia",
    "dataPeriod": "Seed 20260803 / adversarial",
    "keyFinding": "Adversarial coverage packs adjacent and remote regions into crowded port lanes."
  }
}
